{
  "manifestVersion": 1,
  "name": "forge-sidecar-csharp",
  "version": "0.1.0",
  "kind": "sidecar",
  "language": "dotnet",
  "buildTime": "2026-01-01T00:00:00Z",
  "gitSha": "abc1234",
  "gitDirty": false,
  "target": "net9.0-osx-arm64",
  "toolchain": ".NET 9.0",
  "capabilities": ["version-flag", "version-flag-json"],
  "product": "forge"
}
